review_id,reviewer_name,rating,review_date,review
0010822522_7_2,水離子,5.0,2022/04/18,原子習慣可以說是有著成為常識的趨勢。我們都知道，只要有意義，那麼就必須慎重考慮。我想，把原子習慣的意義想清楚，對各位來說並不是一件壞事。我以為我了解原子習慣，但我真的了解原子習慣嗎？仔細想想，我對原子習慣的理解只是皮毛而已。感謝這本書，讓我了解了原子習慣。
0010822522_7_3,有一點微醺才好,4.0,2022/04/18,這本書非常實用！不管是日常生活上或是工作執行細節，只要建立好有規範的、持續性的習慣，相信21天後就可以看到巨大的改變 (當然如果有壞習慣也要記得提醒自己啊) 每個練習每個改變都有意義，就讓我們從原子習慣開始吧!
0010822522_7_4,久坐不動,2.5,2022/04/17,看到很多人買這個所以也買了一本來看看。雖然他說的習慣方式是有用的，但他把簡單的內容寫得太冗長了，導致有點充字數的感覺，如果內容能更簡潔就好了。
0010822522_7_5,罷倉陶,3.5,2022/04/11,不錯的一本書.這本真是人手一本，所以我也買了，這本書太多人討論，細節也沒什麼好說的，我想說的是，這本書裡提到按部就班的方法看似無趣，不過寫得算相當清楚，是真的可以一步步照做的那種。在這層來說，學到不少，算是近期話題書裡比較有建設性，而且又實用的。按上書上的方式我也安排了計劃，實行三個月左右，確實可以慢慢建立一些正向習慣。確實有所收穫，所以給予好評。
0010822522_7_6,千島莎拉,5.0,2022/02/08,以往我認為要獲致成功的人生，必須仰賴生命中一連串戲劇性的「偉大時刻」；如同摩西拿到了十誡，或是海倫凱勒遇到她的家庭教師。如果能有幸遇到人生中的轉捩點，而剛好自己又能抓緊機會，就能創造不一樣的命運，走上通往成功的道路。但是，看完《原子習慣》後，發現這種對某個人生轉捩點的嚮往，太過於夢幻。能夠改變人生的走向的，無法掌控的是「運氣」；能夠掌握的，卻是眼前每一個取決於我們自己的動作：刷牙的方向力道、與家人講話的語調，還有洗衣服前有沒有檢查口袋。每一個動作分開來看，作用實在不可能太大(不會因為有一天沒好好刷牙就人生崩壞)。但是若累積上千上萬次，就能造就人生中非常可觀的成就，嗯…或是困境。在這本《原子習慣》中，作者解說了要養成習慣有哪些心理學上的技巧。例如：不要倚賴意志力來開始及維持一個新的習慣，因為那違反了「大腦愛偷懶」的天性。我們不但要讓好習慣看起來有吸引力，更要讓它看來輕而易舉，慢慢地「引君入彀」。當時機成熟，此習慣已成為我們生活中自然而然的一部份時，它就每天為我們創造可觀的複利效果，而且完全自動化，不需動用大腦寶貴的意志力去下指令。屆時，就可以把大腦的資源運用在使這個好習慣「從A到A+」，抑或是建立生活中其他面向的好習慣。使我們在不知不覺中享受更多這些習慣所帶來的「被動收入」(健康的身體、平靜的心情、令人安心的財富…)有人說，習慣的養成需要21次以上的練習，我覺得不只。但是，如果堅持了21次以上的練習，即使中斷，之後要再重新挑戰的成功率絕對比當初只嘗試兩三次就停下來的人要大得多。2021年的下半年，我運用《原子習慣》的四大法則，漸漸養成每天運動的習慣。希望在2022年的上半年裡，可以再次運用這四大法則，來戒掉喝飲料及吃甜食的習慣。這真的很難，但我仍然期許自己一定要做到。很喜歡一句話：計畫可以修改，但不能停下。當初訂的計畫裡一定有我們非達到不可的夢想，中途也許需要繞道，甚至暫時中斷。但，不需要因為曾經的不順利就將原先的夢想整個拋棄。前往目標的路上，帶著這本《原子習慣》吧!
0010822522_7_7,有一個小敗筆,3.0,2022/01/14,"覺得書的內容和大量的好評有落差在讀過幾本類似的書籍後, 這本給我感覺偏功利主義, 我不是很喜歡, 字裡行間透露出作者至少在當時是非常重視人生必須成名得利才叫成功的人生觀, 當然不否認很多人完全認同這樣的人生觀, 也因為頻率相投而覺得書非常受用因人而異吧, 如果你很想達到世俗所謂的成功, 這本書可能可以帶給你很大的激勵, 如果在“成功”之外你認為還有更重要的追求, 這本書會讓你失望; 不過給了三顆星是因為內容確實有非常實用的部分, 有些幫助習慣養成的“撇步”蠻受用的"
0010822522_7_8,張立健,3.0,2022/01/09,作者 James Clear 是美國著名的棒球運動員。書中分為五章，提出明顯提示、增加吸引力、容易達成和令人滿足四個形成習慣的原則，相反為了戒掉壞習慣便要令其隱藏其存在、減低吸引力、增加其困難和減少其滿足感。首先，作者提出習慣佔領了我們的生活，而習慣通常因無意義中消失，而不是失敗，因此不斷記錄習慣和找到回饋，有助延續良好的習慣，亦令人想起同類型的書籍《The Power of Habit》同樣指出製造良好的環境甚至比自我獎勵更有效，尤其人類容易追求即時快感，而難以自制來換取長遠回報。其次，作者說明習慣能夠成形是由於頻率之多寡，而不是時間長短，並心中更要形成身份，志願成為那一種人。而且基因並不決定你的優秀與否，而是在什麼能力或面向有優勢。再者，不太理解書中的最後一節〈建立好習慣的壞處〉的論點，不知是否與翻譯相關，但期望可以日後重讀英文版掌握這個要點。總而言之，作者試圖解釋改變習慣是可能的，減少壞的習慣，設計更多的好習慣，並持之以恆繼持下去。虎年在即，此書也許是最佳的讀物之一，讓讀者設計不太具挑戰性但是新的習慣，延續好習慣的複利效應。
0010822522_7_9,羅拔,5.0,2021/12/06,起初以為《原子習慣》會是充斥著老生常談、販賣溫情的勵志書籍，事實證明我錯了，它是一本條理分明、脈絡清楚的好書，以行為學、心理學的角度探討微小習慣對改變對生活的益處，且有明確的指引、方法及實例，好看且實用，推薦這本作品。
0010822522_7_10,寫狐,5.0,2021/11/29,若說大多數成功人士共通的要素是什麼，我想好習慣絕對是其中之一。好習慣很重要，但要保持好習慣也很困難。很多人以短暫的衝勁，熱情來激勵自我。常見的說法就是『今年要減肥』，『這禮拜要戒菸』。另一些人會製作計劃表，期許透過嚴謹且完美的計畫，達成目標。可惜，熱情抵不過人性，計劃趕不上變化。好習慣的養成真的如此困難嗎？在《原子習慣》中作者以行為學為基礎，提出四大法則與實際例子來說明如何保持好習慣，戒除壞習慣。培養習慣的四大法則為 ”明顯的提示”，”吸引的習慣”，”簡單的行動”，”滿足的獎賞”，具體來說1.明顯的提示：建立週遭提示及環境因素來養成習慣2.吸引的習慣：藉由模仿目標和正面心態來養成習慣3.簡單的行動：依據簡化步驟的行動因素來養成習慣4.滿足的獎賞：透過立即賞罰和問責機制來養成習慣特別是最後一章 “如何從A到A+“，詳細說明如何在養成好習慣之後持續精進，更是推薦給想更上一層樓的讀者們。今年又快到尾聲，各位朋友還記得您的今年新希望嗎? 若不想讓每年的新希望無限輪迴，請仔細，好好的閱讀本書。
0010822522_7_11,BA,5.0,2021/11/28,還不錯，蠻容易讀完跟試做，大概花了五天慢慢看完，然後找了健身這個主題作為我的習慣練習，每天持續做就在筆記本打勾，給自己目標
0010822522_7_12,Mark Li,3.5,2021/11/26,這些技巧都不是第一次聽到，但作者將這些技巧加上一些案例以及科學的根據，以不同的面貌介紹給讀者，讓我們對這些技巧有另外一層理解。但感覺本書只是多個案例分析之後得到的數個結論，缺乏怎麼在日常生活中應用這些技巧的部分。此外翻譯不夠流暢，句子常要前前後後看很多次才稍微懂要表達什麼。
0010822522_7_13,愛書人,5.0,2021/11/13,這是我近來最愛的書。雖然一早知道習慣的重要性，但作者分析及講解原子習慣的影響及力量，比我想像中要大很多。閱讀這書後，慢慢亦改變了我一些以往的想法，並且改變了我一些生活的態度和習慣。我認為所有人都應該閱讀這本書，大推！
0010822522_7_14,KW,5.0,2021/11/07,"內容實用，很多關於一般生活不知道的小道理，讓我知道時間積少成多的道理,十分適合對於時間管理有問題的人，透過這本書改變自己，讓自己成就不凡"
0010822522_7_15,洪佳吟,5.0,2021/11/07,如果你曾經讀完書後，常常忘記書中內容，並感慨花費的書錢和閱讀的時間。我推薦你得讀完《原子習慣》。我以前也是上述這種人，讀ㄧ讀就忘了，書擺在家中變成裝飾品，對我人生一點加分也沒有，後來知道是沒有實踐書中的概念。《原子習慣》提供的方法很原子——又小又簡單，讓我闔上書本後，直接照做完全無阻礙，而且慢慢地看到成功，在我身上成功後，我推薦學生也這樣用，每個月發下一張「原子好習慣登記表」，一日到三十一日，一共三十一格，自願參加、自列項目、自主評估，當天達標，參加抽獎ㄧ次。既然非強制參加，當然人數不太踴躍，但總是有人參加了，同學眼睜睜地看他每天都能抽獎，經常兌換點數，更驚人的是一個月後的段考成績大幅進步，本月份參加人數因而暴增，現在全班一半以上的學生(八年級)正在力行「原子習慣」。我們師生這麼多人的生命，正受到《原子習慣》的影響呢！
0010822522_7_16,Ivy,5.0,2021/11/06,這本書一直很紅，看了很多推薦書評，就決定入手了。讓人引人入勝的一本書，不會空談理論，而是提出具體實用的方法和例子，也從人的天性、大腦機制和心理等各方面，點出無法培養好習慣和戒除壞習慣的原因，收穫很多，也會想跟周遭親友推薦！
0010822522_7_17,Sabrina,3.5,2021/11/06,過去不以為意的渺小，其實未來回頭去看這些經驗或是渺小事物的累積都會很可觀。非常推薦要著手培養新習慣的讀者，透過書中漸進式的改變，可以讓你發現其實改變不難，就連第一步都很容易。就連過去總覺得一天一點的閱讀習慣、運動習慣甚至是生活小習慣都只是微不足道的東西，長期下來會發現，這些一點一滴的累積其實就是靠著原子習慣累積下來的，而許多成功人士之所以成功，也都是因為靠著一天一點的累積，最終效益放大後生活日常等等的都會變得很不一樣。看完這本書以後，推薦「複利效應」這本書，習慣養成以後，再去看這本就會知道為什麼養成好習慣後到後面許多事物都會突飛猛進。
0010822522_7_18,楊小庭,5.0,2021/11/03,原子習慣封面的兩句話是激勵人心，讓你我有建立好習慣的動機跟期望值！還沒有入手前，心中第一印象是，應該是激發意志力，建立長期目標的心靈力量的書吧！不！完全不是，作者不認為意志力是可以幫助自己建立好習慣的好方法！因為為苦怕難才是人性常態！從人性角度思考，告訴你我，怎麼樣的方法，可以建立好習慣，反過來，又該如何戒掉壞習慣。而時不時的金句，讓人慢慢反思。1、精通習慣由重複開始，而非完美2、讓習慣簡單到就算沒有意願也會執行至關重要（作者舉了一個壞習慣當例子，長時間使用社群網站，就是簡單到你只要動手指）3、基因決定的不是你的命運，而是你在哪個領域會有機會#該找個原子習慣來做一下#改變自己_加強自己
0010822522_7_19,蝦子,5.0,2021/11/03,簡單的心理、物理方式增加動機、達到目標，讓不自律的人，也找到強化自律的動機。好書，看起來。有了這本書，很多自律、成功、健康等等相關書籍都可以不用買了，這本就夠用。
0010822522_8_0,yooq25,5.0,2021/10/30,很多人推薦的一本書，內容用詞不會太艱深，淺顯易懂，慢慢看，每天都有一點收穫，無形之中慢慢的改變，很喜歡裡面提到的複利習慣，積少成多的觀念，確實顛覆不少想法，是一本好書。
0010822522_8_1,安安,5.0,2021/10/28,這本書真的太紅！紅到我一度懷疑大家是否跟風XD，但實際讀完後真的覺得收穫滿滿，也可以理解為何這麼多人討論，甚至連自己也忍不住想推薦！很喜歡書中提到的：「決定自己想成為什麼樣的人，焦點要放在成為某種人，而非得到某種成果」，我們常常會希望達成某個目的，但在追求的過程中卻往往越走越迷失方向，甚至因為覺得太辛苦而容易放棄，但若在拉更遠去想，為什麼我想達成這個目的呢？是因為我想變成什麼樣子或過上什麼樣的生活嗎？那思考的角度以及執行的動力就又更不一樣了！當訂定好方向希望變成什麼模樣時，那接下來做的每個決定便會依照這個準則去行動。書中也舉了很多自身與他人的故事，讓人不會覺得閱讀起來枯燥乏味，有別於其他同類型書籍，原子習慣也不會只講空泛的理論，而是會提出各種方式，讓你在閱讀當下思考，閱讀完後能實際執行。不敢說看完以後一定能為人生帶來莫大改變！但讀完以後一定會有許多啟發，並且對生活是充滿正向思考的，誠心推薦給大家～～～
0010822522_8_2,Ruth,5.0,2021/10/23,身邊許多的人都在看這本書，原本購入只是想說先放著，但過了一陣子翻開才覺得相見恨晚～從打開第一頁到現在大約兩週，生活的步調已經有了很大的不同，感覺奪回了許多時間以及生活的主控權。但個人的讀法是一次讀一些，等調整完一部分的生活習慣後，再繼續讀下一個部分～覺得這樣吸收與實踐的效果更好😄
0010822522_8_3,Marcus,4.5,2021/10/13,此本書很推薦給喜歡一開始心滿滿花很多時間計畫，卻常常剛開始就放棄的人。作者解析習慣養成的四個階段，也是本書的核心思想，並搭配很多的案例以及引用作者本身的經歷來加以解釋習慣養成的自然定律，並且以這四階段為中心來提供實際以及科學的方法教導讀者如何讓一件事情變成潛意識的反應。還在苦惱自己總是半途而廢的你，真的是必看書籍！
0010822522_8_4,玉塵讀書,4.5,2021/10/08,「反覆做著一模一樣的事，卻無止盡地感受到趣味，就是成就卓越的不二法門。你必須愛上無聊。」特別多人在看的一本書，也是我的新年新希望(• ▽ •;)「細微改變帶來成就的實證法則」，作者首先打入養成好習慣才能成功的強心針，說明不斷努力的重要性，強調你感受不到進步只是因為你遇到了「失望之谷」（其實就是撞牆期）健身、跑步如是，感受不到進步帶給你立即的反饋，你便容易會放棄。本書主軸是作者提出了一套理論：提示、渴望、回應、奬賞，分別用章來說明如何強化技巧。例如環境的重要、改變身分認同、最小努力原則、找到監督夥伴、刻意練習的重要等等。涉及心理學、生物學，很全面也很有系統，強調不要用意志力來養成良好習慣，而是要用許多方法的！書中談了很多來強化習慣的養成。本書理論和實踐的方法兼具，沒有艱深的學術名詞透過名人案例把你帶進故事的場域中，文字精準巧妙，很推薦大家可以入藏這本書，可以找到對生命更多的控制權。以下是個人喜歡的句子：（每個人被打動的可能都不同）✒️習慣的效應似乎很小，但幾個月、甚至幾年下來，它們就可能造成極巨大的影響。✒️許多跑者連續努力數月，但衝過終點線之後，就停止訓練了，比賽結束，激勵也隨之消失。✒️我們不是每次都能解釋自己學到什麼，但學習持續進行，而你在特定壯況下注意到相關提示的能力，就是你每個習慣的基礎。✒️我們太執著於想出最棒的做法，到頭來根本沒有著手去做。✒️不想做的時候還是去做，才是最重要的。✒️一旦建立習慣，重要的是持續產生微小的進步。這些小進步與新的挑戰可以讓你保持投入。✒️把一個身分抓得太緊，你就會變得脆弱易碎。失去那一樣東西，你就失去自己了。很適合花一個下午的時間讀完推薦指數：★★★★☆
0010822522_8_5,天晴,4.5,2021/10/08,如同書名：細微的改變帶來巨大成就的實證法則，作者用許多實例讓讀者了解，即使看似微小的改變，只要持續努力去執行，在不知不覺之中就會有超乎自己原先預想的結果。而這些所謂的「習慣」不論好與不好，都在日常生活中默默影響自己，而造就現在的我們。是一本會想要一看再看的書籍！
0010822522_8_6,蝸,5.0,2021/10/06,看得很順，不會覺得天方夜譚，都是日常上可以運用的事，貼近生活、實用，想再看二遍三遍，是常常可以拿出來翻的書。
0010822522_8_7,tina,5.0,2021/10/05,這本書以易懂的例子與故事，讓讀者更容易可以理解習慣背後會造成的巨大影響。而很多我們並不會在意的生活習慣，卻是導致我們無法脫離不理想生活狀態的原因，從小地方改善習慣的行為，便能讓我們能夠慢慢的朝理想中的生活靠近。
0010822522_8_8,KIKI,4.5,2021/10/05,我覺得這本書蠻實用的，疫情那段時間，很常在家，有點不知道未來的一些方向。之前一直有聽過這本書，但像說可能是老生常談，但是實際買來看之後，發現裡面的一些內容其實很有智慧，例如每一天都是一念之間的抉擇，每分每秒下的一個決定，都是會影響一整天的行程。看完友發現有認識一些方法，加上自己也有想去唸英文和跑步，實際執行一段時間，確實成效也蠻不錯的，還算蠻推薦，不過就是要實際去做，才會有用。
0010822522_8_9,陪你讀ReadwithU,5.0,2021/09/30,"作者將習慣的養成歸納成四個循環幾乎可以應用在所有習慣的建立和壞習慣的戒除。我將逐一地和大家聊作者在書中怎麼應用。.「#提示」：讓提示顯而易見「#渴望」：讓習慣有吸引力「#回應」：讓行動輕而易舉「#獎賞」：讓獎賞令人滿足.在習慣的循環之前，作者先建立讀者基礎的觀念。微小的習慣可以不斷重複可以堆疊成行為#複利。還有，改變不要從行為，要從#身分認同 開始。當你想要「戒菸」，當別人拿菸給你時「我正在戒菸」就是從「行為」去改變；而從「身分認同」改變的人則會說：「我不抽菸」這不代表菸對你就沒有吸引力了，而是從根本去成為你想成為的人。.第一點「提示」：#讓提示顯而易見❕做完〔目前的習慣〕之後，我會執行〔需要的習慣〕舉例：我想養成睡前閱讀的習慣→我會在要去洗澡時把書放在枕頭旁→當我躺下時，我就會看到書→提示我要睡前閱讀.第二點「渴望」：#讓習慣有吸引力❕做完〔需要的習慣〕之後，做一件〔想要的習慣〕。舉例：洗澡(已有的習慣)前把書放在枕頭旁(想建立的習慣)→閱讀15分鐘後(完成新習慣)→可以玩一場遊戲(獎勵)。.第三點「回應」：#讓行動輕而易舉❕環境設計❕覺得費力前停止（重點是持續重複做，不是一次做多多）舉例：將電視搬離房間(環境設計)→直接把書放在床頭，持續保持攤開、不闔上→閱讀15分鐘，如果當天太累就看半頁(費力前停止)→可以玩一場遊戲。.第四點「獎賞」：#讓獎賞令人滿足❕行為或獎賞的喜愛程度增加，都可以讓人更容易養成習慣❕但獎賞要能""強化""你的身分認同舉例：在無讓人分心雜物的房間。→洗澡前按下擴香機(讓味道和閱讀產生連結)→選擇超吸引你的類型的書，而非暢銷書→床頭放""閱讀撲滿""，如果讀完15分鐘就在撲滿裡投50元(閱讀撲滿的錢可以用來買書或捨不得買的精緻書籤).有趣的是，作者除了寫如何養成好習慣也教我們如何用這四個循環#改掉壞習慣舉例：想改掉吃零食的壞習慣提示隱而不現：家裡不要放零食，或把零食收在櫃子裡習慣毫無吸引：家裡只能放健康零食，不健康的要走路去買行動困難無比：超喜歡的零食只買一個而且是最小包裝後果令人不滿：夥伴督促，吃高熱量零食時，請他看著你吃.非常精彩的一本書，書中任何一章都是濃縮且必要的存在。"
0010822522_8_10,讀書讀起來,5.0,2021/09/29,聽說這一本書很多人很推薦，不知道這本書會是怎麼樣的一本書，希望內容很豐富，會讓人進步，讓我們一起讀書讀起來
0010822522_8_11,小嫻,5.0,2021/09/27,這本書真的賣很好，總是在排行榜上居高不下，到底有什麼值得學習的地方呢？順應潮流的我也買來閱讀，一看驚為天人，非常簡單的道理，就在我們的生活之中，但我們卻都忽視這個方法，就是：「每天一點一滴的累積。」其實，不用花太多時間，僅管只有花５分鐘，但是持之恆的每天堅持，養成習慣後，累積十年、二十年，從中獲得的效益就會像原子彈一樣驚人。就是這樣簡單的道理，作者用簡單例子，套用在生活中，解盲了我的問題所在，總是看不起小時間，小努力的我，現在不敢忽視小小的累積威力，現在，我都會一直跟小孩說：「每天練習，就一定會進步。」
0010822522_8_12,yinmou,4.0,2021/09/27,這本書我原本以為是很老生常談的書，但因為它的暢銷度而入手一本。這本書介紹改變習慣的方法，是著重細微改變而非目標。或許說，要訂立的目標是做什麼而非達成什麼。達成什麼只是副產品。可能說目標是做什麼(例如每天跑步30分鐘而非一個星期減1KG)很阿Ｑ，但這才會令自己更加容易堅持去做達成目標的活動。那些終極目標只是用來檢視要改變什麼習慣。書中還有很多訂立目標的準則，如何提醒自己／獎勵自己等。若然想建立一個新的習慣(／撇棄壞習慣)，這本書會是一個很好的參考讀物。
0010822522_8_13,張旂睿,2.0,2021/09/03,好多人都推這本書，只有我覺得非常普通嗎？那些道理誰不知道，都是老道理。又是炒作..........很多人盲目亂捧，下次不相信流言 唉
0010822522_8_14,藍,4.5,2021/08/17,這本真是人手一本，所以我也買了，這本書太多人討論，細節也沒什麼好說的，我想說的是，這本書裡提到按部就班的方法看似無趣，不過寫得算相當清楚，是真的可以一步步照做的那種。在這層來說，學到不少，算是近期話題書裡比較有建設性，而且又實用的。按上書上的方式我也安排了計劃，實行三個月左右，確實可以慢慢建立一些正向習慣。確實有所收穫，所以給予好評。
0010822522_8_15,王金財,5.0,2021/08/12,敘述簡單易懂;平易近人，非常適合普羅大眾閱讀的一本由心理學延伸的習慣討論。這本書定調在習慣的討論，但其核心原則可以適用在生活中各個面向，有興趣的讀者也可以試著將四大法則套用進例如商業，領導等等方面。例如業務如何善用這四大法則完成交易，或主管如何建立員工之[良好習慣]。我非常推薦從18節之後的進階策略到附錄的內容，認為是本書之菁華。它因此獲得進入[珍藏書籍特別櫃位]的猶豫資格。進階策略：如何從「A」到「A+」18　基因如何影響習慣的養成19　金髮女孩原則：如何在生活與工作中維持動力20　建立好習慣的壞處〈結語〉讓成果永續的祕訣〈附錄〉來自行為改變四法則的一些啟示
0010822522_8_16,Judy Lai,4.5,2021/08/12,最近計畫15天早睡，最好晚上10:30睡，但ㄧ次無法作到，先設定15天能在晚上12:00前睡，下個15天再依天堅持往前，不要把自己逼死。目前第12天了，繼續努力，未來能養成早睡運動及閱讀的好習慣！
0010822522_8_17,Apple(麗萱),5.0,2021/08/04,作者書寫方式簡單明瞭，舉了相當多實例，讀起來輕鬆愉快，且對於持續力不足或想學習鍛練什麼的人，真的是相當實用的一本書！
0010822522_8_18,瀞予,5.0,2021/08/01,真的非常實用，看了前半段就解惑了我所有謎團!而且第一次有這類型的書能讓我一直看下去，絲毫不無聊，反而能實用於生活中，文字敘述淺顯易懂。
