review_id,reviewer_name,rating,review_date,review
0010822522_4_1,Jason721,5.0,2024/07/27,《原子習慣》強調，微小的習慣累積起來會帶來顯著的改變。這些小習慣可能看似微不足道，但長期堅持下來，會對個人的生活和工作產生深遠的影響。這讓我意識到，與其設定過於宏大的目標，不如從細微之處著手，一步步實現目標書中提出了「習慣形成的四個法則」：提示、渴望、反應和獎勵。這些法則為我提供了一個具體的框架，幫助我理解並建立新的習慣。特別是「提示」這一法則，讓我明白了環境對習慣養成的重要性，並開始主動調整自己的環境來支持新習慣的形成。書中強調了系統而非目標的重要性。與其僅僅專注於最終的目標，不如建立一套有效的系統來不斷改進和調整自己的行為。我開始重視自己日常行為的系統化管理，並定期評估和調整自己的習慣養成計劃。書中介紹的「習慣疊加」策略讓我受益匪淺。將新習慣與已有的習慣結合起來，利用已有習慣的力量來促進新習慣的形成，這樣的策略簡單而高效。我開始將新的健康飲食習慣與每天的運動習慣結合，取得了不錯的效果。《原子習慣》讓我深刻認識到，持之以恆是成功的關鍵。無論是多麼微小的習慣，只要堅持不懈，最終都會產生顯著的改變。這激勵我在面對困難和挫折時不輕易放棄，而是堅持下去，等待變化的積累。總的來說，《原子習慣》這本書給了我很多實用的建議和啟示，幫助我重新審視和改進自己的習慣養成過程。我開始相信，通過微小的、可持續的改變，我能夠實現更大的目標，並且這些改變會在長期內給我的生活帶來積極的影響。
0010822522_4_2,熊爸,5.0,2024/07/25,人生成就，沒有捷徑，成就自己的，不是選擇，而是習慣。習慣的建立，僅靠自己的意志力是不足的，人性不足倚，天命不足依，惟自我身分認同，由內而外的動力，能夠建立習慣。書中強調，造就成功的，是日常習慣，而不是千載難逢的轉變。雖說乘勢待時，事半功倍，但時、勢來臨時，能否御風而上，全憑平日習慣累積的能量。
0010822522_4_3,BK,5.0,2024/06/21,原子習慣，這真的是最近幾年好夯的書，好夯的標題確實是很推薦的一本書讀完之後只要在生活中有實踐一件事的話，那就非常棒了或許是一件很小的事但你一定會有所改變
0010822522_4_4,Shelly,5.0,2024/05/06,很喜歡整本書的架構寫法和內容，裡面提到的小故事都非常貼近現實改變行為習慣的四大法則更是讓我期待應用在生活！很推薦這本書
0010822522_4_5,靜靜人,5.0,2024/05/06,我們可能都有一個感覺，隨著年歲增長，夢想彷彿越飄越遠。努力似乎不再有用，人生的終點站已經無法更改。這本書提供一個思考方式，讓你可以相信自己，實際做出行動，養成習慣，最後改變自己。這本書簡單易懂，每章篇幅不長，很適合通勤時閱讀。書中幾個我喜歡的方法：*Call and Action。要洗碗時，先說：「我要洗碗。」再去洗碗。要寫作業時，先說：「我要寫作業。」這可以使你更專心且不容易出錯。*兩分鐘做事法。想養成一個習慣，每天做兩分鐘就好，重要的是能夠「每一天」。
0010822522_4_6,鹿角蕨,4.0,2024/05/02,一直位居暢銷書排行榜是因為它的淺顯易懂。花了很大篇幅談「習慣」的重要性，可能是激勵（心靈雞湯？），抑或是老阿嬤的裹腳布？此書將習慣的養成拆解具體可行的步驟，讓人有依可循，不過是否真能有所改變，嗯，打個大問號。
0010822522_4_7,小豬,4.5,2024/05/01,雖然愛因斯坦早就這樣說過，但天才離我們太遠，作者透過如何建立原子習慣，來讓我們工作上或是生活上，更能更隨心所欲，活出自我
0010822522_4_8,咖啡店老闆,5.0,2024/04/30,《原子習慣：細微改變帶來巨大成就的實證法則》是一本關於行為改變的寶典。該書通過深入研究人類行為模式，揭示了微小改變對於成就的巨大影響。作者詳細介紹了原子習慣的概念，教導讀者如何透過微小、持續的改變，達成重大目標。這本書不僅提供了實用的策略和方法，還啟發了人們對於個人成長和成功的新思維，是一本改變生活的指南。
0010822522_4_9,Lester,5.0,2024/04/01,跟其他勵志、自我啟發等書籍相比厚度算薄，大約兩三小時就可以看完，內容淺顯易懂，樸實無華，容易執行。有一些獨特的技巧讓讀者可以進入「容易養成好習慣」的情境，也不用花大錢。
0010822522_4_10,Ellen,5.0,2024/03/20,市面上教人設定目標、養成好習慣的書太多了，讀完這本書，深感難怪它盤踞暢銷排行榜前三名這麼久! 作者從心理上、空間上、環境上等對於習慣養成各方面的助力、阻力做了一番詳細的拆解。最棒的是，他洞悉人性中的惰性，以及害怕做不到因此找各種藉口合理化自己布開始養成習慣的心態，用最最最低的要求來鼓勵讀者給自己打氣，例如：至少每天穿上運動鞋，哪怕並沒有真的去運動。穿上運動鞋哪裡會是什麼難事? 但藉由穿上運動鞋這個簡單的動作，在心理上已經大大的激勵自己，覺得自己完成了一項正面的事。此外作者也提到各種環境的提示、一些簡單的小工具(例如每天打勾)，就像童年時每個孩子都為了收集貼紙或好寶寶印章而努力一般，肯定自己今天也堅持做到了該做的事。儘管此書已有無數好評及名家背書，仍然讓我很想好好跟作者說謝謝。僅僅是書中某些小段落的實踐，就讓我自己與小孩都各自在習慣的建立上有顯著的進步，很感激作者的好書。
0010822522_4_11,JC,5.0,2024/03/15,看完這本書後，深深覺得受益匪淺，習慣的養成是從潛移默化的，從自身的改變，才能有好的回饋，讓人獲益良多。
0010822522_4_12,Vicky,4.5,2024/03/10,雖然對我來說，看起來有點困難，但是我還是努力地想從裡面找到能幫助我的方法。即使是渺小的習慣，都可能對未來有極大的影響。建立習慣、養成習慣非常重要，因為對於未來的改變，每個習慣都至關重要。
0010822522_4_13,立之,5.0,2024/03/09,不知如何行動的人？！只會寫計畫表的人？！翻閱此書吧，它會讓您知道該如何一步一步的走上執行的道路。事情不難，只需要一步步地踏出去。
0010822522_4_14,錚雲,4.0,2024/02/24,小小的習慣原來可以改變巨大的未來，就像蝴蝶效應一樣，蝴蝶的翅膀振動，隨著時間的變化，就可能生成遠方的颶風，從小培養習慣，真的重要!
0010822522_4_15,露客,5.0,2024/02/18,"小時課本要大家小立大志, 做大事, 但立了大志, 規劃了大計畫, 卻幾乎都實現不了, 看得這本書, 覺得原來是方法錯誤, 值得細細品味"
0010822522_4_16,哈斯｜Hearth1236,5.0,2024/01/25,單靠意志力無法成事■ 提要有過補習歷史的朋友們，大概對於(1.01)的365次方這句話相當熟悉，若每天進步1%，一年後，你會進步37倍；反之，若沒有全力以赴，即使每天退步1%，一年後，你可能會弱化到趨近於0。但如果努力須不斷要靠意志力苦撐，那麼任誰都會有感到疲憊的時候，因此我們需要仰賴系統化的行為，才能使改變事半功倍。■ 心得書中最重要的當然是讓行為改變的四法則：1. 讓提示顯而易見。2. 讓習慣有吸引力。3. 讓行動輕而易舉。4. 讓獎賞令人滿足。但我個人想提在理論階段，建立「以身份認同為基礎的習慣」的重要。因為若以目標導向，容易在目標達成後中斷行為；但當習慣成為身份認同的一部分，會讓習慣本身化為內在動機，形塑自我認同，每天的實踐行動，都是在向自己證明「我就是這樣的人」，反過頭來強化維持習慣，形成一個正向迴圈。關於這部分，如果感興趣可以看《你可以改變別人》Switch: How to Change Things When Change is Hard，這本書我也介紹過。舉例一下，如果你為了要瘦下來，所以開始調整你的飲食菜單與習慣，在以「為了要瘦下來」為目的同時，其實就給自己貼上「胖子」的身份認同。但如果身分認同轉換成，「我是個飲食健康的人」，如此一來你就會因為這個認同自行調整飲食菜單與習慣。因此正確的身份認同，亦是形塑習慣的重要因素。更多書評請到Dcard/IG/Vocus追蹤 @hearth1236
0010822522_4_17,射手媽咪婷婷,5.0,2024/01/23,如果有一本書出版了好多年，依舊佔據各大排行榜，而且來到一百多刷的成績，是否能吸引你閱讀呢？我想《原子習慣》正是如此的存在，即便讀過以原子習慣為概念的諸多書籍，還是想親自感受一下這本書的魅力何在？原以為這本書講述的概念就是一天改變一點，久而久之就能達成原以為難以企及的目標，但事情並不如我們想得如此簡單，因為在改變的過程中需要用對方法及找對方向，並且還要製造可以激勵自己的因素及排除一切可能的障礙，而要做對每一項細節步驟之前還得先了解自己目前的問題所在，更重要的是先確認自己的觀念與認知是否有誤，否則所做的一切努力可能只是枉然。比如我們通常以為「目標」才是我們所追求的，其實如何達成目標的「系統」才是關鍵，也正是我們能長久持續的主因，作者在書中提到設定目標的目的是贏得比賽，建立系統的目的則是持續待在比賽裡，就拿減肥來說，難道達到設定的目標體重之後便可以放任不管了嗎？還是設想出一個可以讓自己不那麼費力但又能維持目標體重的方法呢？很認同作者提到「習慣」就是身份認同的具體化，而改變習慣最好的方法就是改變身份認同，比如我認定自己是一位寫作者，所以每天寫作就是我的工作，當我把寫作這件事付諸於行動，那就成為了我每天的「習慣」，做起來不僅毫不費力，而且還理所當然地與我對自己的身份認同完全相符，倘若另一個人一樣想寫作，但是只定位為玩票性質，自然無法建立起每天寫作的「習慣」，這就是身份認同影響行動的表現。書中提到心理學家榮格的一段名言：「倘若無法意識到無意識，它就會指揮你的生活，然後你會稱之為命運。」我們時常會聽到許多人怨嘆自己的努力敵不過命運，也直指他人的成功都是「運氣」使然，其實都是沒有意識到自己在許多認知及做法上存在根本性的問題，而那些我們看起來運氣好到不行的人肯定做對了些什麼，而不是只單憑運氣，所以宣揚努力無用的人，與其找台階給自己下，不如先省思自己的思維及現有的作法到底出了什麼問題？或是如同作者提到的可能只是不夠了解自己而選錯了戰場。在這本書中不僅可以得知建立好習慣及破除壞習慣的訣竅，還有如何塑造一個培養好習慣的環境讓我們能事半功倍。
0010822522_4_18,玖遠閱書｜IG：kuon_life23,5.0,2024/01/20,這本書從剛出版購買的那天開始，就被貼上滿滿的便利貼、螢光筆畫線，它打破我從不在書上留下記號的原則。人需要持續到一個程度才能夠定下習慣，但那些習慣也可能因為一兩次的疲累或懶散而打回原形。有太多的興趣，又要去持續同一件事，常常就因分心而中斷，書中的幾句話就很影響我。1.決定你想要成為什麼樣的人。2.透過生活中的小勝利來向自己證明。開始重複實行就對了！要改變你是什麼樣的人，最實際的方法就是改變你做的事。要做出改變，才會有變化！我很認同裡面所教導的一件事。▫️每次寫了一頁，你就是個作家。▫️每次練小提琴，你就是個音樂家。很難持續一件事的我，每次練琴跟寫文、看書時，就會在腦中想起這段話。是一本閱讀完後，重複執行、不要執著要求完美，長久就會發現自己跟著改變的書，很推薦反覆閱讀，在不同時期閱讀時捕捉到的重點又不一樣。
0010822522_4_19,小新,5.0,2024/01/20,好奇這本書為什麼可以暢銷這麼久，不斷聽到、看到有人推薦跟分享，實際上看了內容之後終於理解，書中的方法非常明確且實用，不過要融入生活中是需要練習以及毅力，繼續加油了
0010822522_5_0,小綠,5.0,2024/01/19,本書的優點是淺顯易懂，並且提供了各種養成好習慣的步驟，不過，就像買了減肥書不會立刻變瘦，看完書到真正養成好習慣還是很有距離的，需要個人的努力，但有這本書，在某些自我嫌惡的時刻拿起來重讀，或多或少還是有幫助的，是我書架上的常備書^^
0010822522_5_1,愛看書的小孩,5.0,2024/01/14,一個天才要經過一萬次的練習積砂成塔永遠要相信自己也可能會完成心中的願望這是一本好書 值得擁有放在書櫃裡 時常溫習也是一種好的習慣噢
0010822522_5_2,雪屁貝,4.0,2024/01/08,詹姆斯‧克利爾的《原子習慣：細微改變帶來巨大成就的實證法則》是一本引人入勝的自助書籍，它通過深入研究人類習慣和行為模式，揭示了細微改變如何可以產生重大的影響。閱讀這本書讓我深受啟發，不僅對自己的生活有了更深刻的理解，還提供了實用的工具來改善自己的習慣和行為。克利爾的書以生動的故事、科學研究和實際案例來佐證他的理論。他首先解釋了什麼是“原子習慣”，這些是那些微小的、容易執行的改變，它們可以在生活中產生巨大的影響。然後，他介紹了一系列策略和技巧，幫助讀者建立和改進這些原子習慣，並在各個領域實現成功。其中一個我特別印象深刻的觀點是，克利爾強調了習慣的重要性，並提醒我們，每個人的生活都由習慣所主宰。他的理論不僅解釋了為什麼一些人成功而其他人失敗，還提供了改變不良習慣和建立積極習慣的方法。這使我反思了自己的生活中存在的不良習慣，並開始思考如何用原子習慣來改進它們。克利爾的實例和故事也使這本書更加生動和易於理解。他不僅闡述了成功人士的故事，還分享了他自己的經歷，這讓讀者更容易將書中的理念應用到自己的生活中。總的來說，《原子習慣：細微改變帶來巨大成就的實證法則》是一本具有深刻洞察力的書籍，它不僅提供了有關改進自己習慣的實用建議，還啟發了我們思考生活中的細節和選擇對我們的影響。這本書讓我更有信心地追求自己的目標，並相信細微的改變可以帶來巨大的成就。
0010822522_5_3,安潔莉諾,5.0,2024/01/07,強烈推薦本書!我們都知道知難行易這句話。 但是問題是，我們是真的知道，還是只是停在表面上、邏輯上面的好像知道?  這本書以各種例證再再告訴我們為何滴水可以穿石，為何龜兔賽跑的結局是烏龜贏。 對我而言，學到最實用的部分就是很多時候要養成量好習慣不是光靠無比堅定意志力就好，我們需要仰賴的是環境的、系統的運作和提示。購買此書已經是兩年前的事情了，這本書我會不時翻閱拿來激勵一下自己，畢竟，有時候不小心又開始懈怠了。 或者，我想在多改善其他方面的部分，也會拿來翻閱一下，溫故知新。
0010822522_5_4,starrise,4.0,2023/12/25,很多事道理很簡單，但真要做到就不一定容易。原子習慣說習慣要從每天細小的改變開始培養起就是如此。書中的道理讀者讀過很快就懂，但能否做到就看個人了。有人把這本書當作心靈雞湯，也有人當作自我成長的工具書。這本書暢銷四年了，論述淺顯易懂加上列舉實例，讓人很容易閱讀，再加上字數不多，我想是重要原因。不過看完這本書的人多，但真正看完且能做到改變的恐怕並不是那麼多了。
0010822522_5_5,Derek,5.0,2023/12/12,暢銷超多年，每次的排行榜都看得到這本。原本很反骨，覺得熱門書就不想看，但今年禁不住大家的推薦，終於入手。一看不能說驚為天人，但可以說是難怪這麼多人推薦這本，難怪這本蟬聯暢銷榜。觀看書評就知道每個人得到的收益各有不同，這本書也提供各種培養習慣的方法，一定會有適用於自己的方式。從一點一點的細微改變開始，相信一定會帶來巨大的改變。
0010822522_5_6,Irene,5.0,2023/12/08,閱讀之後給了我很多新的觀念與想法，一步一步的改變，累積起來也能有很大的變化，而且書中提到的實踐方式其實並不會太難，是能做到的方式。
0010822522_5_7,股海人生,4.5,2023/11/18,對於有習慣拖延症的讀者是一大福音，從身分認同感出發，確實更容易達成效果，過程也不覺得痛苦，書中教導讀者多種培養習慣的方式，受益良多
0010822522_5_8,玥,4.5,2023/10/14,透過累積產生複利效應是令人心動的理論，而複利效應成立的前提是要維持足夠長的時間才能有顯著的成效，最好的方式是讓這種累積成為習慣。但建立習慣並非一件容易的事，而結合自己原有的習慣加入一些新的改變這個方法真的很有用！
0010822522_5_9,小太陽,3.5,2023/08/29,慢慢地在試著實踐書中提到的細微改變的力量，以及累積效應，雖然目前沒有太明顯的變化，但有察覺自己的生活有些不一樣，比如每天開始會習慣閱讀，哪怕只有幾分鐘。希望能越來越好，透過這些點點滴滴的改變......
0010822522_5_10,David,5.0,2023/07/31,養成習慣的四個步驟步驟一：讓提示顯而易見。例如：你想養成每天喝水的習慣，就每天裝滿瓶裝水，放在幾個你常出現的地方。提示可以是物品，也可以是時間、地點。例如：每天晚上9點，我會在書房靜心10分鐘！步驟二：讓習慣有吸引力。例如：我想養成每天練習瑜伽，又想看Netflix。那就每天練瑜伽30分鐘之後，再拿出平板追劇。把需要做的事與想做的事連結。步驟三：讓行動輕而易舉。把你要養成習慣的相關物品，放在隨手可得的地方。例如：養成每天練習吉他，就把吉他放在客廳中央。但如果遇到惰性時，可把行動拆成幾個階段。例如：養成早睡早起習慣，階段一每天10點前回家，階段二每天10點前躺在床上，階段三，每天6點起床。步驟四：讓獎賞令人滿足。期待好習慣後的回饋，當回饋得到滿足，才有持續的動力。例如：每週健身三天，身材體態越來越好看。如何讓好習慣精進：習慣+刻意練習=精進。在習慣養成後，還是得不斷反省和察覺當中是否有可改進的地方。例如：運動員的投球姿勢已達到不需思考就可以做出，但成績是否理想，姿勢是否需要調整。
0010822522_5_11,Mr. Loser失敗先生,5.0,2023/07/13,我們誤以為成功人士一定都很有自制力，才能做到那些普通人做不到的事情，比如説早起運動、維持健康生活習慣...等等，但我從原子習慣中獲得的最重要個觀念之一：「最有自制力的人通常最少用到自制力」，一直使用自制力只會消耗掉我們大量的精神，如此一來就無法持續。更何況有許多現實情況的突然出現，會將原本就已經很困難的事情增加難度，例如：1. 訂出要控制飲食的計畫以後，一週之內一定有大吃大喝的飯局出現。2. 今晚下班七點去健身房運動，不是要加班，就是朋友家人現身打斷。3. 我要像成功人士一樣的早起，前一天晚上就會熬夜看一齣精采的美劇。本書給我們的最重要的建議是，讓習慣形成系統，自然地去運作你想要達成的目標，而將稀少的專注力、自制力留給新的任務與事件，而原子習慣就是教我們如何打造這種超棒的習慣系統！
0010822522_5_12,Cherry,5.0,2023/05/28,第一次接觸這本書，是在youtube文森說書的頻道貪懶的自己，以為看完文森的介紹，大概已經掌握本書的精髓殊料，偶然機會在圖書館發現此書，仔細瀏覽後，才知道值得再三細品原因無他，這本書沒有冗贅的學理知識，而是一步步實戰經驗而得的精華能夠切中要點地給予讀書「培養好習慣」、「修正壞習慣」的具體作法文中沒有唱高調，而是逐夢踏實，給予我們清晰而細膩的實行方法與步驟看完書後，我也重拾先前「遠大的計畫」，從每日15分鐘開始落實起相信成功可期、指日可待！這本書，非常推薦給想「培養好習慣」、「修正壞習慣」的你和我喔！
0010822522_5_13,Heidi Pan / IG:panananan,5.0,2023/05/13,"雖然坊間談論 習慣 的書籍非常多 但這本我個人真的蠻推薦因為照著書中提出的方法及心態的轉念來維持一個 適合自己的好習慣真的變得輕而易舉且自然許多 -書中提到 行為改變的四法則：一、讓提示顯而易見二、讓習慣有吸引力三、讓行動輕而易舉四、讓獎賞令人滿足是讓你養成一個好習慣的口訣 -隨時在心中自問「一個健康的人會怎麼做？或是 一個善解人意的人會怎麼做？」就會讓你開始驚艷自己的改變 -打造一個「好習慣」會發生的環境：最有自制力的人,通常是最少用到自制力的人以我為例:我想養成一個不被手機綁架的習慣.1.把所有通知取消提醒.2.開啟月亮模式.這樣一來我開手機就是先回重要的訊息跟瀏覽想看的網頁文章.因為有時候跑出來的動態通知真的沒有重要到需要打斷你寶貴的專注力⋯最後這句話也加入了我的金句本本～{習慣不會限制自由，而是創造自由}"
0010822522_5_14,整理師 紫恩,5.0,2023/05/10,把焦點放在你想成為什麼樣的人，而非得到某一種成果。這本書有一種魔力，是一種簡單有力的能量，每讀一章節，就好像會再強化一次我的意志。我過去讀過很多工作效率、自我成長的書，但是沒有一本像《原子習慣》如此經典，讓我每隔幾年一讀再讀，讀了三次，歷久彌新。書中舉了一個跟整理有關的例子。如果你覺得房間很亂，於是在週末定了「清理」這個目標。若順利完成，那麼你當下可以得到一個乾淨的房間。但是，如果你繼續維持讓房間髒亂的習慣，例如拆了包裹沒有隨手丟掉垃圾、吃完的外食垃圾不馬上處理、穿過跟洗好的衣服堆在一起......那麼很快你就會得到跟原本一樣「髒亂」的環境。想要避免落入重複的循環，你需要改變習慣系統。例如，讓整理垃圾這件事情變得輕鬆、容易，你就會更願意去維持。那麼如果今天是要養成一個新習慣呢？同樣的道理，就是要讓這件事情做起來簡單、輕鬆，至少要讓你願意開始。「秘訣就是在覺得費力之前停止。」James Clear 提到，要維持動力的關鍵，就是執行「難度恰到好處」的任務。如果你想要維持運動習慣，就先從下班後換上運動鞋開始；如果你想要控制體重，就先從減少吃第二碗飯開始；如果你想要開始寫書，就先從每天寫作五分鐘開始。不需要一開始制定超級計畫，因為那會讓你很難真正落實，重點是開始行動，而非完美的計畫。不過，我們一定要不斷地改變嗎？不停的改善嗎？不一定，這是自己的選擇，你也可以很平靜的看待任何狀態：「平靜就是不把觀察結果變成問題：任何行為的第一步都是觀察。你注意到一個提示、一些資訊、一個事件，如果沒有因此採取行動的欲望，就能感覺平靜。 渴望就是想要修正。觀察而沒有渴望，就是明白自己不需要修正任何事。你的欲望沒有氾濫，你並不渴求改變現狀。你的心智沒有製造一個需要解決的問題，你只是觀察著、存在著。」 __ James Clear
0010822522_5_15,小凜,4.0,2023/04/28,個人覺得這本書還算不錯，當初會購買是因為他是排行榜上的書籍。印象最深的是書中教你如何把習慣具體化、變成一小步一小步去做比較容易達成。內容算蠻豐富的，有許多可以參考的地方。
0010822522_5_16,莎菈,4.0,2023/03/30,一步一步慢慢做出改變，實際做了才知道，日常生活小小習慣的影響力。本書內容淺喜易懂，實用性高，堅持很重要，時間會證明。值得推薦給親朋好友
