review_id,reviewer_name,rating,review_date,review
0010822522_8_19,浪,5.0,2021/07/29,一開始會接觸到這本書是因為馬來西亞朋友推薦，當時看到書名的時候還想說為甚麼叫原子習慣，看完之後明白作者想傳達的觀念。每一個看似不起眼的小習慣，長時間累積下來會帶來很可觀的「複利效應」。有別於其他理論類的書籍，作者透過許多成功的實際例子來舉例，加上貼近生活的口吻，讓這本書的觀念更容易被閱讀及吸收，這是近期最喜歡也對生活上有明顯改變的一本書，非常推薦大家閱讀！
0010822522_9_0,U,4.5,2021/07/08,就是好看，只做一個就讓我覺得贏過昨天的我。                     謝謝   真麻煩還要湊五十個字
0010822522_9_1,晨曦,5.0,2021/07/06,在家頹廢的時候看這本書，忽然覺得非常慚愧，每日浪費二個小時的時間，持續浪費一年、十年，看一看深深反省，從小而大的習慣累積，看完本書跟朋友閒聊，發現身邊好幾位朋友都有讀過本書，這真的是一本很有幫助，一棒打醒人的書籍。
0010822522_9_2,書閣,4.0,2021/06/07,此書的重點圍繞在：教導你拋棄過去的壞習慣，並重新建立起好習慣。以及要記得「焦點永遠都要放在成為某一種人，而非得到某一種成果。」作者細緻且全面的探討習慣這件事，每一章節都有更細更多的心法，幫助你養成習慣。以下小小透漏書中的心法，還是建議買一本放在家裡，時刻提醒並常翻閱，才能更加得心應手喔。⭕如何建立好習慣：1⃣讓提示顯而易見（ex.寫下目前習慣方便察覺）2⃣讓習慣有吸引力（ex.加入一個你想要的行為視作常態的文化）3⃣讓行動輕而易舉（ex.打造適合的好環境）4⃣讓獎賞令人滿足（持續追蹤並立即給獎賞）
0010822522_9_3,陳子楹｜lovelove_reading,5.0,2021/06/06,我們的生命是一天一天累積而成的，一天有24小時，1小時有60分鐘，1分鐘有60秒，每一秒的改變，都會造就我們的未來，但是，那「一秒」總是消縱即逝，非常容易被忽略，有誰能真正地意識到自己的每一秒呢。原子習慣的概念也是如此簡單，每一個好、壞習慣的背後，都是由無數個小小的習慣累積而成，幸運的是，我們可以去意識到每一個小習慣的生成。非常喜歡作者詹姆斯‧克利爾（James Clear）在前言提到的這一句話───生命的品質往往取決於習慣的品質。《原子習慣》出版至今，仍然出現在各大排行榜，出自於好奇心入手閱讀後，我終於能夠明白為什麼好習慣比壞習慣更難養成，為什麼壞習慣那麼難以去改變。/IG：lovelove_reading
0010822522_9_4,Nora,5.0,2021/06/06,此書是我看過相關題材的書籍，最精彩且最實用的。陳述方式邏輯緊密，還有許多科學範疇的知識，作者融合心理科學知識來建立習慣。感覺作者有下苦工編排章節，讓讀者能輕鬆閱讀，且章節環環相扣，讀起來很流暢，前後文相關連，且不講太多個人觀感的陳述，讀起來廢話不多，相當精華的一本書。
0010822522_9_5,Anita,5.0,2021/06/01,整個排版非常適合使用3c產品閱讀建議還沒入手的人可以在有電子書推廣的折扣時購入。因爲可依照自己喜歡的版面排列非圖檔， 閱讀起來順又快。內容非常值得一讀，實用又精彩是近期很棒的一本實用好讀的書
0010822522_9_6,Li,5.0,2021/05/31,作者提出的每個法則都會搭配實際例子和簡單的舉例，增加了許多說服力和可信度，看完這本書真的會讓人覺得自己可以透過微小的習慣改變生活，我看完之後也在煩悶的生活中做出了改變，很適合給想要擺脫壞習慣和沒有生活重心的人。
0010822522_9_7,金髮女孩,3.0,2021/05/30,內容講了很多關於培養習慣的好方法，是近年來很非常少見而且非常實際可以培養習慣的書籍。但翻譯上面真的有很大的進步空間。有許多奇怪的翻譯用法，比如「很了」大概是想說很了解的意思，但是這麼獨創的翻譯方式反而造成了閱讀上的困難。以及有些可能是原文上沒有敘述夠完整的地方，書中只是直接照翻，在這個地方真的很可惜。
0010822522_9_8,一隻狗,1.5,2021/05/28,原書寫的非常好，怎樣改善生活，改掉壞習慣，但中文翻譯太爛，不知所云，上下文不通，中文程度不好，用原書對照才了解作者想表達的，翻不好實在可惜
0010822522_9_9,無名,5.0,2021/05/20,因為實在名氣太大，所以買回家看看過之後，書的內容介紹許多現代人問題處理方法，是一本值得推推薦大家買來看
0010822522_9_10,Lynn,4.0,2021/05/20,是本很有趣的書，不會太深難 作者提出的想法都滿有意思的內容透過作者的親身經歷以及舉出的例子，再將其詳細說明作者想告訴我們如何實施原子習慣的方法。但其實最重要的還是你自己有沒有決心這麼做，這本書適合即將踏入挑戰的人若像是在疫情無法外出期間閱讀這本書，實在是無動力去實行書裡面的任何步驟。書很好就取決於你有沒有決心和動力去做改變。
0010822522_9_11,Oliver Wu,5.0,2021/05/17,這本書我拜讀兩次，(現在正在重讀第2次)，非常棒！特別是我真的按照書中所教的內容操作，我把「提示」弄得很容易看到，運用習慣的堆壘，發展了幾個我想要的習慣，像是運動健身，我以前常常都會「忘記」這件事，現在我把健身器材放在我常常看得到的地方，並用了「習慣追蹤器」每天檢視我當日的行為並紀錄。我真心跟你推薦這本書！真的寫得非常非常的好！
0010822522_9_12,君詠,3.5,2021/05/17,這一本書很多都有推，IG上的讀書帳也推很多。不過書是書。裡面確實有很多值得學習的地方。但最重要的是，在書的封面。與那句「持之以恆」講真的三天打漁兩天曬網，那不如不要。然後看完有一種改變習慣的想法深深印在腦海。不過這個習慣是慢慢的改，而不是一蹴及就。要記好
0010822522_9_13,小小,5.0,2021/05/16,買這本之前猶豫非常久因為工作關係看過非常多工作法、心理健康與生活類用書，知道大部分這類型書籍內容都非常灌水，用一個空泛的理論無盡延伸、分享幾個個案，或是提供現實上根本不可能實現的解法，讀起來很雞肋不過看到這本一直在排行榜上，還是燃起了好奇心結果感覺就好像是把過去看過的書本們中的精華全都濃縮起來一樣，幾乎整本書大部分的篇幅都是金句，而且內容非常扎實讀起來非常愉快又充滿能量的一本書！
0010822522_9_14,張壽司,5.0,2021/05/16,之前在各個社群網站都能看到推薦這本原子習慣的文章或是貼文…讓本人非常好奇到底本書有什麼魅力讓眾人一致好評又推薦如潮！？認真研讀之後，發現書中用淺顯易懂的方式告訴人性如何養成習慣，為何好習慣跟壞習慣的養成不一樣，又是什麼行為模式導致我們養成習慣，簡單四個模式帶出本書精華，讓人可以練習如果養成習慣，不論好壞，都能用本書的方法來練習
0010822522_9_15,Mandy,5.0,2021/05/15,書中作者除了提供不少因為持續微小習慣而成功故事，也針對如何打造好習慣跟戒除壞習慣有很詳細的說明！非常推薦！看書途中我也有親自嘗試一些書中的範例，因此而真的有在生活上建立新的好習慣，比如說把新習慣變得容易發生，想多看書就把書本放在顯而易見的位置，一開始可以使用作者說的2分鐘法則，循序漸進真的就可以很好維持新習慣！只要你有想要自我成長或是培養好習慣，真的很推薦這本書！ :)
0010822522_9_16,Qni,5.0,2021/05/13,透過這本書學習到如何透過追蹤審視自己習慣，並運用書中方式養成好習慣與戒除壞習慣，需要時隨時都可拿出來提醒自己很棒的工具書。
0010822522_9_17,coco,4.5,2021/05/10,與其說人的歷史軌跡是直線前進，不如說是一段不斷重複的迴圈。個人、群體、思想、城市、國家，歷經了長期的蟄伏，到了一定的時刻開始大鳴大放，過了巔峰不免開始衰退，而最終又...
0010822522_9_18,Katelyn,4.5,2021/05/07,這本書小標題貫穿了整本書的宗旨！如果你也是看了很多書或文章知道好習慣的重要，卻一直苦無方法成功建立好習慣，消滅壞習慣，那這本書就是為你準備的！書中內容有些是我們已經知道的觀念，但作者不是一直提倡理念，而是用各種實際的作法與科學的實驗結果，教你如何一步一步在生活中建立好習慣！這本書帶給我的影響很大，希望能記錄下來讓還沒看過書的有緣人也可以因此找到好方法建立各種好習慣。
0010822522_9_19,000｜IG@000readsss☕️,5.0,2021/05/06,一本將會改變你人生的書籍原子習慣幫助我：・兩週內戒除社群媒體成癮・戒除宵夜、垃圾食物、酒精・開始寫作、記錄想法書中提到很重要的觀念，在想成就任何事情之前先以「我想成為什麼樣的人」作為內心主旨，以此為利基開始建立一個「生而為__人」應有的習慣系統在書店光是短短幾秒的重點翻閱(當日未購買)就成就了我當天的健康飲食與運動行程極度推薦！
0010822522_10_0,阿J,5.0,2021/05/05,滿不錯的書，說明習慣的重要，持續著一點小習慣，可能帶往你好的結果跟壞的結果，改變人生，書中教授如何維持習慣，對於想改變現況的人來說或許會有幫助。
0010822522_10_1,認真魔人,4.0,2021/05/05,先簡介這本書，主要就是先心理建設(一小部分)，然後給予培養好習慣跟去除壞習慣的各種方法，方法跟方法之間有些許關聯，每個方法都有實例參考，算是淺顯易懂。但是這些方法我個人覺得道理是有道理，但就是沒有想要去實作的動力，譬如：要吃甜食前要先喊：我要吃甜食了！讓自己的腦袋清楚意識到自己的行為。從這本書我得到的最大的收穫應該是他的心理建設的部分，就是相信自己是個怎樣的人，你自然而然會成為怎樣的人，當然是要真正的相信，(當然也要排除一些特例，譬如果相信我是台中金城武，就算我真正的相信我也不會變帥)，舉例來說：可能因為某次英文考試考高分，我相信我英文很好，造成我看更多的英文書，又造成下次英文成績好。這種相信改變了我們的行為，行為改變了我們的結果，結果讓我們更相信的循環，真的至關重要。也可以舉反面的：可能因為某次英文成績不佳，我相信我英文很爛，我認為我讀了還是考不好而不讀英文，造成下次英文成績更差。它可以是好的循環也可以是壞的循環，這個循環的道理我們都正在發生，但我們可能沒有自覺。
0010822522_10_2,阿泥,5.0,2021/05/03,眾人推薦不是沒有原因！裡面有許多讓我們改變習慣的小技巧，個人認為要一次全學有點困難。但如果能帶走一兩個觀念，落實於生活中，再慢慢持續增加，相信會更有助益。
0010822522_10_3,YY,4.0,2021/05/03,很好看，書本內容介紹許多現代人問題處理方法，我很喜歡作者的寫作風格，前綫異動，學校老師教學最適合的用書，很欣賞作者處理事情的態度，推薦大家原子習慣這本書！
0010822522_10_4,星爆先生,3.5,2021/05/03,本書旨意在於培養個人習慣，以及消除負面習慣，書中內容最重要習慣法則，無論好或壞習慣，第一點都起源於提示。以喜歡滑社群軟體為例，作者自身愛滑手機社群軟體，於是把自己手機在工作時收好，並請助理改密碼，於是他便能專心工作。養成好或壞習慣往往取決於一個小動作，想要每天看書，就把書放在顯眼的地方讓自己注意，想要天天運動，就把明天要用的運動服先準備好。長久持續下去，習慣會是你的，幫助你受用無窮，整體來說這本書實在不錯，值得買一本。
0010822522_10_5,嘿嘿,5.0,2021/04/23,有道理 但做的時候還是常常不成功我常常看得時候或看完1個禮拜能做到書中講的 但之後會慢慢回到原本狀態 不能持之以恆
0010822522_10_6,更平等的勞資環境靠大家爭取,2.0,2021/04/23,因為實在名氣太大，所以買回家看確實是有些不錯的研究發現和見解，個人很推薦後面18.從A到A+那邊還有許多實例都很有趣但是整體而言，我覺得沒有特別好內容也有滿多地方不知所云、語焉不詳
0010822522_10_7,婐肆白金會員,5.0,2021/04/21,這本書以諸多實例驗證養成小習慣的好處，並歸納出如何養成好習慣及戒掉壞習慣的方法，以個人為中心作為出發點，再加上營造出人們周遭環境可以帶來的影響力，並以時間複利的思考方式量化原子習慣的效益，是本值得反覆閱讀並幫助我們實踐目標的好書!
0010822522_10_8,ODOM,5.0,2021/04/21,【原子習慣：細微改變帶來巨大成就的實證法則】值得閱讀，適合一邊閱讀一邊覺察與紀錄自己的習慣，執行一段時間後發現，真的有效!!!
0010822522_10_9,Staysee,4.5,2021/04/21,實用、一針見血，提供了大量範例與操作，若你想建立良好習慣，沒問題！想拔起不良習慣，有方法！一步步實作，一步步打就更好的自己。但若能將一個案例重頭至尾操作完整，將更能突顯作者的神奇之處。
0010822522_10_10,阿山,5.0,2021/04/20,這是一本針對個人在面對自己的惰性，以及不斷迎面而來問題的解決方法，就是每天維持進步一點點，在每個地方、每一個步驟都是這樣，就可以打造出不同的自己
0010822522_10_11,小火,5.0,2021/04/19,每年或是想做什麼事的時候我們都會許下一個願望，希望可以達成，也會規畫每天要做一些事來達成這個願望，但總是一個月、二個月、幾個月後就默默地不繼續了，很多人都這樣，包括我，因為總是想要快速達成，所以總是失敗，原子習慣這本書，讓我了解不要一直去想希望達成的目標，應該是關注每天給自己的目標有沒有達到，這個才是真正的捷徑。
0010822522_10_12,Lu,5.0,2021/04/19,一開始在看這本書的前言時被作者的經歷深深震撼，讓還不習慣看文字的我，有一種像在看電視劇一般，充滿好奇心的想繼續看下去，作者在討論許多觀點前，常用一個故事或實驗作為開端，讓我能夠更快速的進入情境，總體來說這是一本簡單有趣並富有內容的自我成長書籍。
0010822522_10_13,Pei,5.0,2021/04/18,很實用的一本書，只要願意堅持，即使一次只改變一點點，終將達到自己的目標。這本書中很詳細寫到習慣改變的實踐方式及可能遇到的困難，並且將達成目標的方法用原子習慣不斷的累積，更加容易實踐
0010822522_10_14,訪客,5.0,2021/04/17,之前就聽到很多推薦這本書的聲音，最近有機會入手這本書，終於可以親自閱讀這本書，當然讀完之後覺得是本好書，也會繼續推薦其他朋友！一起來習慣養成
0010822522_10_15,楊鈺山,5.0,2021/04/16,這本書是好書！觀點分析精闢，原子習慣，推薦。一開始會讀這本書，純粹是因為朋友推薦。每個人都知道習慣的養成對人生有多麽的重要，但是真正能夠把習慣的重要性運用於生活周遭進而改變人生的例子，卻仍然很少。作者告訴我們，不要把目標訂得太遠大，卻忘了開始執行的重要，既使每天只有進步一點點，累積起來的進步也是非常驚人的。
0010822522_10_16,Mia,4.5,2021/04/16,本書透過許多舉例，非常淺顯易懂。透過每個章節循序漸進的閱讀，對於習慣的養成方式會有不同面向的了解。章節編排很好，可以跟著章節一點一點實踐。譯者的翻譯很棒，讀起來很容易理解。對我很有幫助的一本書！
0010822522_10_17,Beryl.,4.5,2021/03/30,看了很多人的評論當中，大家都表示多多少少買過這種講述習慣方面的書籍，但我是第一買，並且覺得受益良多。這本書算是相當實用的工具書了，裡面很完美的融入了很多其他學術理論&實戰經驗分享，並且在好習慣與壞習慣的章節開頭，都有一個表讓你可以直接重點提示。在很迷惘的時候，可以快速找到自己想要了解並且改善的癥結點。就像書裡面強調的，所謂原子習慣，並不是一開始就設一個非常遠大的目標，而通常一般人也很少直接能夠達成那個最終目的(我自己就是這樣..)，半途而廢根本常有的事。於是利用這本書，可以輕鬆地針對自己想要改善，或是培養的習慣，要如何地去操作，進而慢慢養成、推進，而達成最終那個自己想要成為的人。最重要的是，裡面提到的方法並不會讓人覺得執行困難，反而很容易入手！並且有很多種不同的方法提供給在不同前提環境下，可以變換的方式，並不是那麼死。因此很推薦這本相當實用的工具書！
0010822522_10_18,Rita Lei Chen 雷晨,3.5,2021/03/15,最開始認為又是一本認知學勵志睡前讀物，讀了讀後，雖然觀點都沒有多新穎，但組合起來的論述讓我啟發頗多。非常好的書。這本書闡述了兩個基本觀點：細微習慣產生的邊際效應對於人生的改變。習慣是一種自發性行為，由觸發，欲望，行為，獎勵四部分組成。促進自己養成一個習慣就要從這四個部分做文章。作者對於習慣的各方各面論述的還是相當清晰的，而且也很合理，很具說服力。為了養成一個自己不情願的習慣，第一我們要讓觸發可見，實際上是要讓觸發非常可見。假如觸發抽煙欲望的是打火機，那麼想要抽煙的你就把打火機放在自己能看見的最明顯的位置。反過來戒掉抽煙就要讓觸發抽煙的引子離自己越遠越好。第二，我們要讓行為的欲望足夠吸引人。這一點作者講的不是很出彩。文中舉了一些快餐，廣告的例子，這些東西製作得光鮮亮麗來引起觀眾的欲望。不過拓展到生活中，思路就不是很明確了。作者最後還是總結到我們要佈置好自己的環境，讓欲望更容易看見，更明顯，blablabla，和第一點差不多。第三，我們要讓行為更簡單。習慣的行為部分是最實際操作的部分。為了養成運動的習慣，不管怎麼觸發，怎麼挑起欲望，我們最終還是要走上跑步機。所以就要將行為定義的足夠簡單。不是要每天跑20分鐘，30分鐘，而是盡量將習慣定義的容易完成，以保持每天的執行不間斷。比如，每天只要換好衣服走上跑步機就算完成今天的習慣了。聽上去很好笑，但是真正這麼執行的時候，會發現真的走上跑步機，自己也就自動跑起來了。即使當天真的有事無法鍛煉，從跑步機上跑兩步立刻下來也不會造成任何心理負擔。重點是讓行為習慣每天得以很輕松地維持下去。促進觸發、欲望、行為這三者的關聯越來越緊。第四，給予獎勵。獎勵和欲望是一對元素，有了欲望，我們會行動，行動過後獲得了獎勵，大腦就會對這個行為進行加權（人工智慧看多了），長此以往，該行為觸發最後變成自動化的習慣，比如那隻聽見鈴聲就流口水的狗。獎勵部分的要點是，獎勵一定要是每次行為之後立刻獲得的，即使很小。不要做那種堅持三十天我就xxx的約定。後置的獎勵無法讓大腦產生反應，從觸發到獎勵的這個刺激循環也就無法建立了。另一部分讓我覺得很精彩的內容就是作者對於邊際效應的闡述。每一個細小的習慣疊在一起最後塑造了我們這個獨一無二的人。這是作者貫徹全文的一個思想。塑造習慣很重要的一點是重新佈置環境。每一個環境的細節都會導致我們最終做或者不做某件事。堅持習慣的人並不是神，中途放棄的人也不是loser。他們的區別並沒有大到基因的層面。可能只是計劃用的日歷究竟是掛在卧室正面的牆上還是收在抽屜里的區別。還有一點也和我產生不小的共鳴。想要改變一個行為習慣，除了將視線放在具體的行為上，還應該改變Identity，自我認知。比如，一個普通的職員，想要讓自己提升管理能力，他會選擇增加溝通的習慣，增加總結的習慣。但一系列臨時的改變在外人眼裡多半會呈現出一種關公面前耍大刀的滑稽感。並且這些習慣因為做起來不符合身份習慣也很難持續下去。為什麼？因為自我定位沒有改變。如果從每天的一開始就以管理層的身份來看待自己。產生的變化將不僅只在溝通、總結這種點上。定位的改變帶來了思考方式的改變，講話的方式，行為的方式，甚至坐姿，平時開玩笑的內容都會產生變化，全方位的細小改變最後重新塑造一個人的外在表現。
0010822522_10_19,可悲高中生,5.0,2021/02/20,相同於蝴蝶效應之原理以微小改變帶來意想不到的收穫，完整的統整了所有跟習慣培養相關的理論和方法，甚至也可以逆推過來消除掉不想要的習慣，是非常詳盡、全面的一本書。
0010822522_11_0,Atomic habits,4.5,2021/02/09,"如果每天進步一些些，哪怕只是千分之一的進步，持續做下去，你就會進步好幾倍；相對的，如果每天退步一些些，哪怕只是零點零零一的退步，不久之後就會弱化到趨近於零。""時間""會放大成功，也會放大失敗。"
0010822522_11_1,S,5.0,2021/02/08,看過不少關於習慣養成、戒除壞習慣、如何讓生活更好的書籍，只能說不管看再多，都推薦一定要再讀這一本。作者強大的透析力彷彿看穿我們的生活，給予確實能達成的中肯建議，能夠在閱讀一本書時一直有茅塞頓開的感覺，這是第一次，總之請務必看看。
0010822522_11_3,挖西格西,5.0,2021/01/26,今天看到追蹤的粉絲頁又介紹了這本書，讓我又想要再重新看一遍了。這本書真的很不錯，每次看都有不同的想法，如何對自己說話、幫自己找到定位，一開始做對了，後續的人事物發展就會不斷朝著期望的、正面的方向前進。值得推薦的經典好書。
0010822522_11_4,Yuhsuan,4.0,2021/01/22,覺得還不錯，作者說明的很詳細而且分列清楚，也舉了很多例子，讓我在看的時候不會覺得很枯燥！裡面的確有很多點是可以幫助自己改掉壞習慣及建立好習慣的
0010822522_11_5,balance,3.5,2021/01/18,"看了沒有像別人對它評價那麼高,只覺得還行,和一大堆相關書籍相同,看了就是放一旁,類似零極限或讓天賦自由"
0010822522_11_6,樹,5.0,2020/12/30,我從小對任何事就是三分鐘熱度，對於好習慣建立實在是一件很難一直維持的行動，但心中又有一股很大的聲音：「就是想成為有一番大作為的人！」 ，而大作為的人其實都是靠平常好習慣累積複利而成的結果，促使自己開始尋找方法。剛開始閱讀時，確實讓我覺得這本書能帶給我多大的幫助？不過作者敘述方式和步驟讓我感到改變其實很簡單沒有壓力的，重點是持續不間斷！這本算是今年看到屬一屬二實用的工具書了，可定期回味一下作者提供的方式。從作者的寫作風格可了解到他是個謙虛的人，不將自己的成就誇大，很喜歡這樣閱讀氣氛。
0010822522_11_8,M,5.0,2020/11/30,"很推!非常實用的一本書,過程中鉅細靡遺的講述方式和舉例,但又不是難以做到的方法,不過改變還是要自己親身經歷過才會成真!"
0010822522_11_9,arthur28,5.0,2020/11/24,總結：很值得閱讀的一本書，光看完第一章就足以讓你針對自身習慣做出改變。本書厲害的一點在於將你原本以為理所當然或搞不太清楚原因的現象用清晰的文字描述出來，並加以解釋，這些解釋是有所依據的，而不是作者的胡言亂語，讓你更了解自身行為底層的意義。書中有提供滿多實際執行的方法，主要方向是建立好習慣、戒除壞習慣、選擇適合的環境讓好習慣更加分、當碰到停滯期的時候如何堅持下去等等，非常推薦。
0010822522_11_10,很少一本書可以看這麼快,5.0,2020/11/22,一本停不下來的好書很少看書可以一次性看完文筆相當流暢很多觀點一邊看會不自覺一直點頭完全推薦可以購入的一本書
0010822522_11_11,婷,4.5,2020/11/17,看這本書的時候會思考很多原來一個習慣居然有這麼多的因素互相影響這本書的內容會讓人想用書中的方法讓自己往好的方向努力
